{
  "format": "hako_viewer_model",
  "version": "0.1",
  "coordinate_system": "mujoco",
  "robot": {
    "name": "hakoniwa_truck",
    "root": "vehicle"
  },
  "assets": [
    {
      "id": "vehicle",
      "type": "glb",
      "path": "parts/vehicle.glb"
    },
    {
      "id": "front_left_wheel",
      "type": "glb",
      "path": "parts/front_left_wheel.glb"
    },
    {
      "id": "front_right_wheel",
      "type": "glb",
      "path": "parts/front_right_wheel.glb"
    },
    {
      "id": "rear_left_wheel",
      "type": "glb",
      "path": "parts/rear_left_wheel.glb"
    },
    {
      "id": "rear_right_wheel",
      "type": "glb",
      "path": "parts/rear_right_wheel.glb"
    }
  ],
  "base": {
    "name": "vehicle",
    "asset": "vehicle",
    "mount": {
      "xyz": [
        0.0,
        0.0,
        0.0
      ],
      "rpy": [
        0.0,
        0.0,
        0.0
      ]
    }
  },
  "movable_parts": [
    {
      "name": "front_left_steer",
      "joint": "front_left_steer_joint",
      "parent": "vehicle",
      "mount": {
        "xyz": [
          2.15,
          0.925,
          0.0
        ],
        "rpy": [
          0.0,
          0.0,
          0.0
        ]
      },
      "motion": {
        "type": "continuous",
        "axis": [
          0.0,
          0.0,
          1.0
        ]
      }
    },
    {
      "name": "front_left_wheel",
      "joint": "front_left_wheel_joint",
      "parent": "front_left_steer",
      "mount": {
        "xyz": [
          0.0,
          0.0,
          0.0
        ],
        "rpy": [
          0.0,
          0.0,
          0.0
        ]
      },
      "motion": {
        "type": "continuous",
        "axis": [
          0.0,
          1.0,
          0.0
        ]
      },
      "asset": "front_left_wheel"
    },
    {
      "name": "front_right_steer",
      "joint": "front_right_steer_joint",
      "parent": "vehicle",
      "mount": {
        "xyz": [
          2.15,
          -0.925,
          0.0
        ],
        "rpy": [
          0.0,
          0.0,
          0.0
        ]
      },
      "motion": {
        "type": "continuous",
        "axis": [
          0.0,
          0.0,
          1.0
        ]
      }
    },
    {
      "name": "front_right_wheel",
      "joint": "front_right_wheel_joint",
      "parent": "front_right_steer",
      "mount": {
        "xyz": [
          0.0,
          0.0,
          0.0
        ],
        "rpy": [
          0.0,
          0.0,
          0.0
        ]
      },
      "motion": {
        "type": "continuous",
        "axis": [
          0.0,
          1.0,
          0.0
        ]
      },
      "asset": "front_right_wheel"
    },
    {
      "name": "rear_left_wheel",
      "joint": "rear_left_wheel_joint",
      "parent": "vehicle",
      "mount": {
        "xyz": [
          -2.15,
          0.85,
          0.0
        ],
        "rpy": [
          0.0,
          0.0,
          0.0
        ]
      },
      "motion": {
        "type": "continuous",
        "axis": [
          0.0,
          1.0,
          0.0
        ]
      },
      "asset": "rear_left_wheel"
    },
    {
      "name": "rear_right_wheel",
      "joint": "rear_right_wheel_joint",
      "parent": "vehicle",
      "mount": {
        "xyz": [
          -2.15,
          -0.85,
          0.0
        ],
        "rpy": [
          0.0,
          0.0,
          0.0
        ]
      },
      "motion": {
        "type": "continuous",
        "axis": [
          0.0,
          1.0,
          0.0
        ]
      },
      "asset": "rear_right_wheel"
    }
  ]
}
