{
  "format": "hako_viewer_model",
  "version": "0.1",
  "coordinate_system": "mujoco",
  "robot": {
    "name": "hakoniwa_person_staff",
    "root": "person"
  },
  "assets": [
    {
      "id": "person",
      "type": "glb",
      "path": "parts/person.glb"
    },
    {
      "id": "arm_left",
      "type": "glb",
      "path": "parts/arm_left.glb"
    },
    {
      "id": "arm_right",
      "type": "glb",
      "path": "parts/arm_right.glb"
    },
    {
      "id": "leg_left",
      "type": "glb",
      "path": "parts/leg_left.glb"
    },
    {
      "id": "shin_left",
      "type": "glb",
      "path": "parts/shin_left.glb"
    },
    {
      "id": "leg_right",
      "type": "glb",
      "path": "parts/leg_right.glb"
    },
    {
      "id": "shin_right",
      "type": "glb",
      "path": "parts/shin_right.glb"
    }
  ],
  "base": {
    "name": "person",
    "asset": "person",
    "mount": {
      "xyz": [
        0.0,
        0.0,
        0.0
      ],
      "rpy": [
        0.0,
        0.0,
        0.0
      ]
    }
  },
  "movable_parts": [
    {
      "name": "arm_left",
      "joint": "shoulder_left_joint",
      "parent": "person",
      "mount": {
        "xyz": [
          0.0,
          0.27,
          1.1
        ],
        "rpy": [
          0.0,
          0.0,
          0.0
        ]
      },
      "motion": {
        "type": "continuous",
        "axis": [
          0.0,
          1.0,
          0.0
        ]
      },
      "asset": "arm_left"
    },
    {
      "name": "arm_right",
      "joint": "shoulder_right_joint",
      "parent": "person",
      "mount": {
        "xyz": [
          0.0,
          -0.27,
          1.1
        ],
        "rpy": [
          0.0,
          0.0,
          0.0
        ]
      },
      "motion": {
        "type": "continuous",
        "axis": [
          0.0,
          1.0,
          0.0
        ]
      },
      "asset": "arm_right"
    },
    {
      "name": "leg_left",
      "joint": "hip_left_joint",
      "parent": "person",
      "mount": {
        "xyz": [
          0.0,
          0.105,
          0.66
        ],
        "rpy": [
          0.0,
          0.0,
          0.0
        ]
      },
      "motion": {
        "type": "continuous",
        "axis": [
          0.0,
          1.0,
          0.0
        ]
      },
      "asset": "leg_left"
    },
    {
      "name": "leg_right",
      "joint": "hip_right_joint",
      "parent": "person",
      "mount": {
        "xyz": [
          0.0,
          -0.105,
          0.66
        ],
        "rpy": [
          0.0,
          0.0,
          0.0
        ]
      },
      "motion": {
        "type": "continuous",
        "axis": [
          0.0,
          1.0,
          0.0
        ]
      },
      "asset": "leg_right"
    },
    {
      "name": "shin_left",
      "joint": "knee_left_joint",
      "parent": "leg_left",
      "mount": {
        "xyz": [
          0.0,
          0.0,
          -0.32
        ],
        "rpy": [
          0.0,
          0.0,
          0.0
        ]
      },
      "motion": {
        "type": "continuous",
        "axis": [
          0.0,
          1.0,
          0.0
        ]
      },
      "asset": "shin_left"
    },
    {
      "name": "shin_right",
      "joint": "knee_right_joint",
      "parent": "leg_right",
      "mount": {
        "xyz": [
          0.0,
          0.0,
          -0.32
        ],
        "rpy": [
          0.0,
          0.0,
          0.0
        ]
      },
      "motion": {
        "type": "continuous",
        "axis": [
          0.0,
          1.0,
          0.0
        ]
      },
      "asset": "shin_right"
    }
  ]
}
