{
  "format": "hako_viewer_model",
  "version": "0.1",
  "coordinate_system": "mujoco",
  "robot": {
    "name": "hakoniwa_car2",
    "root": "vehicle"
  },
  "assets": [
    {
      "id": "vehicle",
      "type": "glb",
      "path": "parts-red/vehicle.glb"
    },
    {
      "id": "steering_wheel",
      "type": "glb",
      "path": "parts-red/steering_wheel.glb"
    },
    {
      "id": "front_left_wheel",
      "type": "glb",
      "path": "parts-red/front_left_wheel.glb"
    },
    {
      "id": "front_right_wheel",
      "type": "glb",
      "path": "parts-red/front_right_wheel.glb"
    },
    {
      "id": "rear_left_wheel",
      "type": "glb",
      "path": "parts-red/rear_left_wheel.glb"
    },
    {
      "id": "rear_right_wheel",
      "type": "glb",
      "path": "parts-red/rear_right_wheel.glb"
    }
  ],
  "base": {
    "name": "vehicle",
    "asset": "vehicle",
    "mount": {
      "xyz": [
        0.0,
        0.0,
        0.0
      ],
      "rpy": [
        0.0,
        0.0,
        0.0
      ]
    }
  },
  "movable_parts": [
    {
      "name": "front_left_steer",
      "joint": "front_left_steer_joint",
      "parent": "vehicle",
      "mount": {
        "xyz": [
          1.3,
          0.76,
          0.0
        ],
        "rpy": [
          0.0,
          0.0,
          0.0
        ]
      },
      "motion": {
        "type": "continuous",
        "axis": [
          0.0,
          0.0,
          1.0
        ]
      }
    },
    {
      "name": "front_left_wheel",
      "joint": "front_left_wheel_joint",
      "parent": "front_left_steer",
      "mount": {
        "xyz": [
          0.0,
          0.0,
          0.0
        ],
        "rpy": [
          0.0,
          0.0,
          0.0
        ]
      },
      "motion": {
        "type": "continuous",
        "axis": [
          0.0,
          1.0,
          0.0
        ]
      },
      "asset": "front_left_wheel"
    },
    {
      "name": "front_right_steer",
      "joint": "front_right_steer_joint",
      "parent": "vehicle",
      "mount": {
        "xyz": [
          1.3,
          -0.76,
          0.0
        ],
        "rpy": [
          0.0,
          0.0,
          0.0
        ]
      },
      "motion": {
        "type": "continuous",
        "axis": [
          0.0,
          0.0,
          1.0
        ]
      }
    },
    {
      "name": "front_right_wheel",
      "joint": "front_right_wheel_joint",
      "parent": "front_right_steer",
      "mount": {
        "xyz": [
          0.0,
          0.0,
          0.0
        ],
        "rpy": [
          0.0,
          0.0,
          0.0
        ]
      },
      "motion": {
        "type": "continuous",
        "axis": [
          0.0,
          1.0,
          0.0
        ]
      },
      "asset": "front_right_wheel"
    },
    {
      "name": "rear_left_wheel",
      "joint": "rear_left_wheel_joint",
      "parent": "vehicle",
      "mount": {
        "xyz": [
          -1.3,
          0.76,
          0.0
        ],
        "rpy": [
          0.0,
          0.0,
          0.0
        ]
      },
      "motion": {
        "type": "continuous",
        "axis": [
          0.0,
          1.0,
          0.0
        ]
      },
      "asset": "rear_left_wheel"
    },
    {
      "name": "rear_right_wheel",
      "joint": "rear_right_wheel_joint",
      "parent": "vehicle",
      "mount": {
        "xyz": [
          -1.3,
          -0.76,
          0.0
        ],
        "rpy": [
          0.0,
          0.0,
          0.0
        ]
      },
      "motion": {
        "type": "continuous",
        "axis": [
          0.0,
          1.0,
          0.0
        ]
      },
      "asset": "rear_right_wheel"
    },
    {
      "name": "steering_wheel",
      "joint": "steering_wheel_joint",
      "source_joint": "front_left_steer_joint",
      "multiplier": 15.0,
      "parent": "vehicle",
      "asset": "steering_wheel",
      "mount": {
        "xyz": [
          0.45,
          -0.38,
          0.59
        ],
        "rpy": [
          0.0,
          0.436332,
          0.0
        ]
      },
      "motion": {
        "type": "continuous",
        "axis": [
          1.0,
          0.0,
          0.0
        ]
      }
    }
  ]
}
